CREATE TABLE t1 (d double, i int);
CREATE TABLE t2 (v varchar(30), i int);
CREATE TABLE t3 (d double, i int);
INSERT INTO t1 VALUES (1.79769313486231e+308, 1);
INSERT INTO t1 VALUES ('inf', 2);
Warnings:
Warning	1265	Data truncated for column 'd' at row 1
INSERT INTO t3 SELECT * FROM t1;
SELECT t1.i FROM t1, t3 WHERE t1.d = t3.d ORDER BY i;
i
1
2
SELECT t1.i FROM t1, t3 WHERE t1.d = t3.d ORDER BY i;
i
1
2
DELETE FROM t3;
INSERT INTO t2 SELECT IEEE754_TO_STRING(d), i FROM t1;
INSERT INTO t3 SELECT * FROM t2;
SELECT t1.i FROM t1, t3 WHERE t1.d = t3.d ORDER BY i;
i
1
2
DELETE FROM t1;
DELETE FROM t2;
DELETE FROM t3;
DROP TABLE t3;
INSERT INTO t1 VALUES (NULL, 0);
INSERT INTO t1 VALUES ('inf', 0);
Warnings:
Warning	1265	Data truncated for column 'd' at row 1
INSERT INTO t1 VALUES ('nan', 0);
Warnings:
Warning	1265	Data truncated for column 'd' at row 1
INSERT INTO t1 VALUES (-0e0, 1);
INSERT INTO t1 VALUES (+0e0, 2);
INSERT INTO t2 SELECT IEEE754_TO_STRING(d), i FROM t1;
INSERT INTO t1 SELECT * FROM t2;
SELECT COUNT(*), IEEE754_TO_STRING(d) FROM t1 GROUP BY d ORDER BY d, i;
COUNT(*)	IEEE754_TO_STRING(d)
2	NULL
6	0
2	-0
DROP TABLE t1;
DELETE FROM t2;
CREATE TABLE t1 (f float, i int);
INSERT INTO t1 VALUES (1.0e+38, 0);
INSERT INTO t1 VALUES (NULL, 0);
INSERT INTO t1 VALUES ('inf', 0);
Warnings:
Warning	1265	Data truncated for column 'f' at row 1
INSERT INTO t1 VALUES ('nan', 0);
Warnings:
Warning	1265	Data truncated for column 'f' at row 1
INSERT INTO t1 VALUES (-0e0, 1);
INSERT INTO t1 VALUES (+0e0, 2);
INSERT INTO t2 SELECT f, i FROM t1;
INSERT INTO t1 SELECT * FROM t2;
SELECT COUNT(*), f FROM t1 GROUP BY f ORDER BY f, i;
COUNT(*)	f
2	NULL
6	0
2	-0
2	1e38
SELECT COUNT(*), f FROM t1 GROUP BY f ORDER BY f, i;
COUNT(*)	f
2	NULL
6	0
2	-0
2	1e38
DROP TABLE t1;
DROP TABLE t2;
