call mtr.add_suppression("entry .* in mysql.user is ignored because it duplicates entry in mysql.system_user");
create database d1;
create table d1.t1 (n int);
insert into mysql.user (User, Host, Select_priv, ssl_cipher, x509_issuer, x509_subject)
values ('user1', 'localhost', 'Y', '', '', '');
flush privileges;
select * from d1.t1;
n
insert into mysql.system_user (User, Host, Select_priv, ssl_cipher, x509_issuer, x509_subject)
values ('user1', 'localhost', 'N', '', '', '');
flush privileges;
select * from d1.t1;
ERROR 42000: SELECT command denied to user 'user1'@'localhost' for table 't1'
update mysql.system_user set Select_priv = 'Y', Insert_priv = 'Y' where user = 'user1';
flush privileges;
insert into d1.t1 values (1);
select * from d1.t1;
n
1
delete from mysql.system_user where User = 'user1';
flush privileges;
insert into d1.t1 values (2);
ERROR 42000: INSERT command denied to user 'user1'@'localhost' for table 't1'
select * from d1.t1;
n
1
insert into mysql.system_user (User, Host, Select_priv, Insert_priv, ssl_cipher, x509_issuer, x509_subject)
values ('user1', 'localhost', 'N', 'Y', '', '', '');
flush privileges;
select * from d1.t1;
ERROR 42000: SELECT command denied to user 'user1'@'localhost' for table 't1'
insert into d1.t1 values (3);
select * from d1.t1;
n
1
3
delete from mysql.user where User = 'user1';
delete from mysql.system_user where User = 'user1';
insert into mysql.user (User, Host, Select_priv, Insert_priv, ssl_cipher, x509_issuer, x509_subject)
values ('user1', 'local%', 'N', 'Y', '', '', '');
insert into mysql.user (User, Host, Select_priv, Insert_priv, ssl_cipher, x509_issuer, x509_subject)
values ('', 'localhost', 'Y', 'N', '', '', '');
flush privileges;
select user(), current_user();
user()	current_user()
user1@localhost	@localhost
select * from d1.t1;
n
1
3
insert into d1.t1 values (4);
ERROR 42000: INSERT command denied to user ''@'localhost' for table 't1'
insert into mysql.system_user (User, Host, Select_priv, Insert_priv, ssl_cipher, x509_issuer, x509_subject)
values ('user1', 'local%', 'N', 'Y', '', '', '');
flush privileges;
select user(), current_user();
user()	current_user()
user1@localhost	user1@local%
select * from d1.t1;
ERROR 42000: SELECT command denied to user 'user1'@'localhost' for table 't1'
insert into d1.t1 values (5);
select * from d1.t1;
n
1
3
5
delete from mysql.user where User = '' and Host = 'localhost';
delete from mysql.user where User = 'user1';
delete from mysql.system_user where User = 'user1';
insert into mysql.system_user (User, Host, Select_priv, Insert_priv, ssl_cipher, x509_issuer, x509_subject)
values ('user1', 'localhost', 'N', 'Y', '', '', '');
flush privileges;
grant SELECT on *.* to user1@localhost;
ERROR HY000: Incorrect usage of GRANT and SYSTEM USER
grant INSERT on *.* to user1@localhost;
ERROR HY000: Incorrect usage of GRANT and SYSTEM USER
drop user user1@localhost;
ERROR HY000: Incorrect usage of DROP and SYSTEM USER
create user user1@localhost identified by 'foo';
ERROR HY000: Operation CREATE USER failed for 'user1'@'localhost'
rename user user1@localhost to user2@localhost;
ERROR HY000: Incorrect usage of RENAME and SYSTEM USER
create user user2@localhost;
rename user user2@localhost to user1@localhost;
ERROR HY000: Incorrect usage of RENAME and SYSTEM USER
grant SELECT, INSERT, UPDATE, DELETE on *.* to user2@localhost;
select * from d1.t1;
n
1
3
5
select User, Host, Select_priv, Update_priv from mysql.system_user;
User	Host	Select_priv	Update_priv
user1	localhost	N	N
insert into mysql.system_user (User, Host, Select_priv, ssl_cipher, x509_issuer, x509_subject)
values ('user3', 'localhost', 'Y', '', '', '');
ERROR 42000: Access denied; you need the SUPER privilege for this operation
update mysql.system_user set Update_priv = 'Y' where User = 'user1';
ERROR 42000: Access denied; you need the SUPER privilege for this operation
delete from mysql.system_user where User = 'user1';
ERROR 42000: Access denied; you need the SUPER privilege for this operation
insert into mysql.user (User, Host, Select_priv, ssl_cipher, x509_issuer, x509_subject)
values ('user3', 'localhost', 'Y', '', '', '');
update mysql.user set Update_priv = 'Y' where User = 'user3';
select User, Host, Select_priv, Update_priv from mysql.user;
User	Host	Select_priv	Update_priv
root	127.0.0.1	Y	Y
root	HOSTNAME	Y	Y
root	localhost	Y	Y
user2	localhost	Y	Y
user3	localhost	Y	Y
delete from mysql.user where User = 'user3';
revoke all on *.* from user2@localhost;
grant SELECT, INSERT, UPDATE, DELETE on mysql.* to user2@localhost;
select * from d1.t1;
ERROR 42000: SELECT command denied to user 'user2'@'localhost' for table 't1'
select User, Host, Select_priv, Update_priv from mysql.system_user;
User	Host	Select_priv	Update_priv
user1	localhost	N	N
insert into mysql.system_user (User, Host, Select_priv, ssl_cipher, x509_issuer, x509_subject)
values ('user3', 'localhost', 'Y', '', '', '');
ERROR 42000: Access denied; you need the SUPER privilege for this operation
update mysql.system_user set Update_priv = 'Y' where User = 'user1';
ERROR 42000: Access denied; you need the SUPER privilege for this operation
delete from mysql.system_user where User = 'user1';
ERROR 42000: Access denied; you need the SUPER privilege for this operation
revoke all on mysql.* from user2@localhost;
grant SELECT, INSERT, UPDATE, DELETE on mysql.system_user to user2@localhost;
select * from d1.t1;
ERROR 42000: SELECT command denied to user 'user2'@'localhost' for table 't1'
select User, Host, Select_priv, Update_priv from mysql.system_user;
User	Host	Select_priv	Update_priv
user1	localhost	N	N
insert into mysql.system_user (User, Host, Select_priv, ssl_cipher, x509_issuer, x509_subject)
values ('user3', 'localhost', 'Y', '', '', '');
ERROR 42000: Access denied; you need the SUPER privilege for this operation
update mysql.system_user set Update_priv = 'Y' where User = 'user1';
ERROR 42000: Access denied; you need the SUPER privilege for this operation
delete from mysql.system_user where User = 'user1';
ERROR 42000: Access denied; you need the SUPER privilege for this operation
revoke all on mysql.system_user from user2@localhost;
drop database d1;
delete from mysql.system_user;
delete from mysql.user where User = 'user1' or User = 'user2';
flush privileges;
