create table t1 (i int);
insert into t1 values (1);
update mysql.db set User = 'root' where User = '';
create table mysql.user_bak like mysql.user;
insert into mysql.user_bak select * from mysql.user where length(User) = 0;
delete from mysql.user where length(User) = 0;
flush privileges;
create user rolefoo@localhost identified by 'foo';
grant usage on *.* to rolefoo@localhost;
grant select on *.* to rolefoo@localhost;
create mapped user bogusfoo@localhost identified by 'bar' role 'bogus';
ERROR HY000: Operation CREATE MAPPED USER failed for 'bogusfoo'@'localhost'
create mapped user bogusfoo identified by 'bar' role 'bogus';
drop mapped user bogusfoo@localhost;
ERROR HY000: Operation DROP USER failed for 'bogusfoo'@'localhost'
create mapped user mapfoo identified by 'bar' role 'rolefoo';
create mapped user dropfoo identified by 'bar' role 'rolefoo';
connect(localhost,bogusfoo,bar,test,MASTER_PORT,MASTER_SOCKET);
ERROR 28000: Access denied for user 'bogusfoo'@'localhost' (using password: YES)
drop mapped user bogusfoo;
connect(localhost,mapfoo,foo,test,MASTER_PORT,MASTER_SOCKET);
ERROR 28000: Access denied for user 'mapfoo'@'localhost' (using password: YES)
select user(), current_user();
user()	current_user()
rolefoo@localhost	rolefoo@localhost
select user(), current_user();
user()	current_user()
dropfoo@localhost	rolefoo@localhost
drop user dropfoo;
ERROR HY000: Operation DROP USER failed for 'dropfoo'@'%'
drop mapped user dropfoo;
connect(localhost,dropfoo,foo,test,MASTER_PORT,MASTER_SOCKET);
ERROR 28000: Access denied for user 'dropfoo'@'localhost' (using password: YES)
select user(), current_user();
user()	current_user()
mapfoo@localhost	rolefoo@localhost
select User, Role from mysql.mapped_user;
User	Role
mapfoo	rolefoo
create mapped user mapfoo identified by 'bar' role 'rolefoo';
ERROR HY000: Operation CREATE MAPPED USER failed for 'mapfoo'@'%'
create mapped user mapfoo1 identified by 'bar1' role 'rolefoo';
drop mapped user mapfoo1;
create mapped user mapfoo identified by 'bar1' role 'rolefoo';
select User, Role from mysql.mapped_user;
User	Role
mapfoo	rolefoo
mapfoo	rolefoo
select distinct User, Role, Password from mysql.mapped_user order by 1, 2, 3;
User	Role	Password
mapfoo	rolefoo	*50275DCAC24DA7E634D1139D15FED2AD08C72C06
mapfoo	rolefoo	*E8D46CE25265E545D225A8A6F1BAF642FEBEE5CB
create user role1;
grant all privileges on test.* to role1;
create mapped user user1 identified by 'foo' role 'role1';
create database d1;
create table d1.t1 (n int);
insert into d1.t1 values (1);
select * from d1.t1;
ERROR 42000: SELECT command denied to user 'role1'@'localhost' for table 't1'
use d1;
ERROR 42000: Access denied for user 'role1'@'%' to database 'd1'
grant select on *.* to role1;
select * from d1.t1;
n
1
use d1;
select * from t1;
n
1
insert into t1 values (2);
ERROR 42000: INSERT command denied to user 'role1'@'localhost' for table 't1'
grant insert on *.* to role1;
insert into t1 values (3);
select * from t1;
n
1
3
delete from t1 where n=1;
ERROR 42000: DELETE command denied to user 'role1'@'localhost' for table 't1'
grant delete on *.* to role1;
delete from t1 where n=3;
select * from t1;
n
1
revoke insert on *.* from role1;
insert into t1 values (4);
ERROR 42000: INSERT command denied to user 'role1'@'localhost' for table 't1'
insert into d1.t1 values (5);
select * from d1.t1;
n
1
5
revoke select on *.* from role1;
select * from t1;
ERROR 42000: SELECT command denied to user 'role1'@'localhost' for table 't1'
delete from t1;
select * from d1.t1;
n
insert into d1.t1 values (6);
revoke delete on *.* from role1;
delete from t1;
ERROR 42000: DELETE command denied to user 'role1'@'localhost' for table 't1'
select * from d1.t1;
n
6
select * from d1.t1;
ERROR 42000: SELECT command denied to user 'role1'@'localhost' for table 't1'
use d1;
ERROR 42000: Access denied for user 'role1'@'%' to database 'd1'
update mysql.user set Select_priv = 'Y' where User = 'role1';
flush privileges;
select * from d1.t1;
n
6
update mysql.user set Select_priv = 'N' where User = 'role1';
flush privileges;
select * from d1.t1;
ERROR 42000: SELECT command denied to user 'role1'@'localhost' for table 't1'
grant select on d1.* to role1;
select * from d1.t1;
n
6
use d1;
select * from t1;
n
6
insert into t1 values (7);
ERROR 42000: INSERT command denied to user 'role1'@'localhost' for table 't1'
grant insert on d1.* to role1;
insert into t1 values (8);
select * from t1;
n
6
8
update mysql.db set Insert_priv = 'N' where Db = 'd1' and User = 'role1';
flush privileges;
insert into t1 values (9);
ERROR 42000: INSERT command denied to user 'role1'@'localhost' for table 't1'
update mysql.db set Insert_priv = 'Y' where Db = 'd1' and User = 'role1';
flush privileges;
insert into t1 values (10);
delete from t1;
ERROR 42000: DELETE command denied to user 'role1'@'localhost' for table 't1'
grant delete on d1.* to role1;
delete from t1 where n=6;
select * from t1;
n
8
10
revoke all on d1.* from role1;
select * from t1;
ERROR 42000: SELECT command denied to user 'role1'@'localhost' for table 't1'
insert into t1 values (11);
ERROR 42000: INSERT command denied to user 'role1'@'localhost' for table 't1'
delete from t1;
ERROR 42000: DELETE command denied to user 'role1'@'localhost' for table 't1'
select Select_priv from mysql.db where Db = 'd1' and User = 'role1';
Select_priv
insert into mysql.db (Host, Db, User, Select_priv)
values ('%', 'd1', 'role1', 'Y');
flush privileges;
select * from t1;
n
8
10
delete from mysql.db where Db = 'd1' and User = 'role1';
flush privileges;
select * from t1;
ERROR 42000: SELECT command denied to user 'role1'@'localhost' for table 't1'
use d1;
select * from t1;
n
8
10
create user role2@localhost;
grant all on *.* to role2@localhost;
select user(), current_user();
user()	current_user()
user1@localhost	role1@%
select * from t1;
ERROR 42000: SELECT command denied to user 'role1'@'localhost' for table 't1'
update mysql.mapped_user set Role = 'role2' where User = 'user1';
flush privileges;
select user(), current_user();
user()	current_user()
user1@localhost	role2@localhost
select * from t1;
n
8
10
update mysql.mapped_user set Role = 'role1' where User = 'user1';
flush privileges;
select user(), current_user();
user()	current_user()
user1@localhost	role1@%
select * from t1;
ERROR 42000: SELECT command denied to user 'role1'@'localhost' for table 't1'
drop user role2@localhost;
grant all privileges on *.* to role1 with grant option;
create procedure inf_loop()
sql security invoker
begin
loop_label: loop
select * from d1.t1;
end loop loop_label;
end;//
select * from t1;
n
8
10
call inf_loop();
drop mapped user user1;
select * from t1;
Got one of the listed errors
create mapped user user1 identified by 'foo' role 'role1';
use d1;
select * from t1;
n
8
10
call inf_loop();
drop user role1;
select * from d1.t1;
Got one of the listed errors
create user role1;
grant all privileges on *.* to role1 with grant option;
use d1;
select * from t1;
n
8
10
drop mapped user user1;
create mapped user user1 identified by 'foo' role 'role1';
select * from t1;
Got one of the listed errors
use d1;
select * from t1;
n
8
10
drop user role1;
create user role1;
grant all privileges on *.* to role1 with grant option;
select * from t1;
Got one of the listed errors
select * from d1.t1;
n
8
10
update mysql.mapped_user set Password = password('asdf') where User = 'user1';
flush privileges;
select * from d1.t1;
Got one of the listed errors
select * from d1.t1;
Got one of the listed errors
select * from d1.t1;
n
8
10
delete from mysql.mapped_user where User = 'user1';
flush privileges;
select * from d1.t1;
Got one of the listed errors
select * from d1.t1;
Got one of the listed errors
create mapped user user1 identified by 'foo' role 'role1';
select * from d1.t1;
n
8
10
delete from mysql.user where User = 'role1';
flush privileges;
select * from d1.t1;
Got one of the listed errors
select * from d1.t1;
Got one of the listed errors
create user role1;
grant all privileges on *.* to role1 with grant option;
select * from d1.t1;
n
8
10
update mysql.mapped_user set User = 'user2' where User = 'user1';
flush privileges;
update mysql.mapped_user set User = 'user1' where User = 'user2';
flush privileges;
select * from d1.t1;
n
8
10
select * from d1.t1;
n
8
10
create mapped user role1 identified by 'foo' role 'bogus';
select * from d1.t1;
n
8
10
drop mapped user role1;
select * from d1.t1;
n
8
10
select * from d1.t1;
n
8
10
create user user1;
select * from d1.t1;
ERROR 70100: Query execution was interrupted
select * from d1.t1;
Got one of the listed errors
drop user user1;
create user user2;
select * from d1.t1;
n
8
10
rename user user2 to user1;
select * from d1.t1;
ERROR 70100: Query execution was interrupted
select * from d1.t1;
Got one of the listed errors
rename user user1 to user2;
select * from d1.t1;
n
8
10
rename user user2 to user1;
rename user user1 to user2;
select * from d1.t1;
n
8
10
use test;
drop database d1;
drop user role1;
drop user user2;
drop mapped user user1;
drop table t1;
update mysql.db set User='' where User='root';
insert into mysql.user select * from mysql.user_bak;
drop table mysql.user_bak;
drop mapped user mapfoo;
select User, Role from mysql.mapped_user;
User	Role
drop user rolefoo@localhost;
flush privileges;
