create database foobar;
create database foobar2;
use foobar2;
create table f1(i int);
insert into f1 values (0);
use foobar;
create table t1(i int);
insert into t1 values (1);
create table t2(i int);
insert into t2 values (1);
update mysql.db set User = 'root' where User = '';
create table mysql.user_bak like mysql.user;
insert into mysql.user_bak select * from mysql.user where length(User) = 0;
delete from mysql.user where length(User) = 0;
flush privileges;
create user rolefoo@localhost identified by 'foo';
create mapped user mapfoo identified by 'bar' role rolefoo;
create mapped user mapfoo2 identified by 'bar' role rolefoo;
grant select on foobar.t1 to rolefoo@localhost;
grant select on foobar.t2 to rolefoo@localhost;
grant insert on foobar.t2 to rolefoo@localhost;
select count(*) from t1;
count(*)
1
insert into t1 values (0);
ERROR 42000: INSERT command denied to user 'rolefoo'@'localhost' for table 't1'
update t1 set i=0 where i=1;
ERROR 42000: UPDATE command denied to user 'rolefoo'@'localhost' for table 't1'
delete from t1;
ERROR 42000: DELETE command denied to user 'rolefoo'@'localhost' for table 't1'
insert into t2 values (0);
select count(*) from foobar2.f1;
ERROR 42000: SELECT command denied to user 'rolefoo'@'localhost' for table 'f1'
create table c1(i int, j int);
grant select (i) on foobar.c1 to rolefoo@localhost;
select j from c1;
ERROR 42000: SELECT command denied to user 'rolefoo'@'localhost' for column 'j' in table 'c1'
select i from c1;
i
Got one of the listed errors
Got one of the listed errors
SHOW PROCESSLIST;
Id	User	Host	db	Command	Time	State	Info
#	mapfoo	localhost	foobar	Query	#	NULL	SHOW PROCESSLIST
update mysql.db set User='' where User='root';
insert into mysql.user select * from mysql.user_bak;
drop table mysql.user_bak;
drop mapped user mapfoo;
drop mapped user mapfoo2;
select User, Role from mysql.mapped_user;
User	Role
drop user rolefoo@localhost;
flush privileges;
drop database foobar;
drop database foobar2;
