update mysql.db set User = 'root' where User = '';
create table mysql.user_bak like mysql.user;
insert into mysql.user_bak select * from mysql.user where length(User) = 0;
delete from mysql.user where length(User) = 0;
flush privileges;
create user rolefoo@localhost identified by 'foo';
grant select on *.* to rolefoo@localhost;
create mapped user mapfoo identified by 'bar' role 'rolefoo';
""
"fails for 172"
""
update mysql.user set Host = '172.%' where User = 'rolefoo';
flush privileges;
connect(localhost,rolefoo,foo,test,MASTER_PORT,MASTER_SOCKET);
ERROR 28000: Access denied for user 'rolefoo'@'localhost' (using password: YES)
connect(localhost,mapfoo,bar,test,MASTER_PORT,MASTER_SOCKET);
ERROR 28000: Access denied for user 'mapfoo'@'localhost' (using password: YES)
""
"OK for wildcard"
""
update mysql.user set Host = '%' where User = 'rolefoo';
flush privileges;
select 'rolefoo,rolefoo', current_user(), user();
rolefoo,rolefoo	current_user()	user()
rolefoo,rolefoo	rolefoo@%	rolefoo@localhost
select 'rolefoo,mapfoo', current_user(), user();
rolefoo,mapfoo	current_user()	user()
rolefoo,mapfoo	rolefoo@%	mapfoo@localhost
""
"OK for localhost"
""
update mysql.user set Host = 'localhost' where User = 'rolefoo';
flush privileges;
select 'rolefoo,rolefoo', current_user(), user();
rolefoo,rolefoo	current_user()	user()
rolefoo,rolefoo	rolefoo@localhost	rolefoo@localhost
select 'rolefoo,mapfoo', current_user(), user();
rolefoo,mapfoo	current_user()	user()
rolefoo,mapfoo	rolefoo@localhost	mapfoo@localhost
update mysql.db set User='' where User='root';
insert into mysql.user select * from mysql.user_bak;
drop table mysql.user_bak;
drop mapped user mapfoo;
select User, Role from mysql.mapped_user;
User	Role
drop user rolefoo@'localhost';
flush privileges;
