# Prepare play-ground
select user(), current_user();
user()	current_user()
root@localhost	root@localhost
create table mysql.user_bak like mysql.user;
insert into mysql.user_bak select * from mysql.user where User = '';
delete from mysql.user where User = '';
create table mysql.db_bak like mysql.db;
insert into mysql.db_bak select * from mysql.db where User = '';
delete from mysql.db where User = '';
flush privileges;
create table t1 (i int);
create table t2 (i int);
insert into t1 values (1);
insert into t2 values (1);
create user rolefoo@localhost identified by 'bar';
grant select on test.t1 to rolefoo@localhost;
insert into mysql.mapped_user values
('rolefoo', 'mapfoo', password('bar'), '2020-01-01'),
('rolefoo', 'mapfoo2', password('bar'), '2020-01-01');
flush privileges;
# Confirm that access control works for the user
select user(), current_user();
user()	current_user()
rolefoo@localhost	rolefoo@localhost
show grants;
Grants for rolefoo@localhost
GRANT USAGE ON *.* TO 'rolefoo'@'localhost' IDENTIFIED BY PASSWORD '7c9e0a41222752fa'
GRANT SELECT ON `test`.`t1` TO 'rolefoo'@'localhost'
select * from t1;
i
1
select * from t2;
ERROR 42000: SELECT command denied to user 'rolefoo'@'localhost' for table 't2'
# Confirm that access control works for the mapped user
select user(), current_user();
user()	current_user()
mapfoo@localhost	rolefoo@localhost
show grants;
Grants for rolefoo@localhost
GRANT USAGE ON *.* TO 'rolefoo'@'localhost' IDENTIFIED BY PASSWORD '7c9e0a41222752fa'
GRANT SELECT ON `test`.`t1` TO 'rolefoo'@'localhost'
select * from t1;
i
1
select * from t2;
ERROR 42000: SELECT command denied to user 'rolefoo'@'localhost' for table 't2'
# Confirm that access control works for the mapped user
select user(), current_user();
user()	current_user()
mapfoo2@localhost	rolefoo@localhost
show grants;
Grants for rolefoo@localhost
GRANT USAGE ON *.* TO 'rolefoo'@'localhost' IDENTIFIED BY PASSWORD '7c9e0a41222752fa'
GRANT SELECT ON `test`.`t1` TO 'rolefoo'@'localhost'
select * from t1;
i
1
select * from t2;
ERROR 42000: SELECT command denied to user 'rolefoo'@'localhost' for table 't2'
select User, Role, Password from mysql.mapped_user order by 1, 2, 3;
User	Role	Password
mapfoo	rolefoo	7c9e0a41222752fa
mapfoo2	rolefoo	7c9e0a41222752fa
delete from mysql.mapped_user where user in ('mapfoo', 'mapfoo2');
flush privileges;
drop user rolefoo@localhost;
select User, Role from mysql.mapped_user;
User	Role
drop table t1;
drop table t2;
insert into mysql.db select * from mysql.db_bak;
drop table mysql.db_bak;
insert into mysql.user select * from mysql.user_bak;
drop table mysql.user_bak;
flush privileges;
