flush user_statistics;
update mysql.db set User = 'root' where User = '';
create table mysql.user_bak like mysql.user;
insert into mysql.user_bak select * from mysql.user where length(User) = 0;
delete from mysql.user where length(User) = 0;
flush privileges;
create user p@localhost identified by 'pw';
create mapped user mp identified by 'pw' role p;
grant select on test.* to p@localhost;
grant process on *.* to p@localhost;
Confirm count is correct after connect
select User, Concurrent_connections from information_schema.user_statistics where User = 'p';
User	Concurrent_connections
p	1
Connections for p should be 1
select User, Concurrent_connections from information_schema.user_statistics where User = 'mp';
User	Concurrent_connections
mp	1
Connections for mp should be 1
select Role, Sum(Concurrent_connections) from information_schema.user_statistics where Role = 'p';
Role	Sum(Concurrent_connections)
p	2
Connections for Role p should be 2
select User, Total_connections from information_schema.user_statistics where User = 'p';
User	Total_connections
p	1
Total Connections for p should be 1
select User, Total_connections from information_schema.user_statistics where User = 'mp';
User	Total_connections
mp	1
Total Connections for mp should be 1
select Role, Sum(Total_connections) from information_schema.user_statistics where Role = 'p';
Role	Sum(Total_connections)
p	2
Total Connections for Role p should be 2
select User, Total_connections from information_schema.user_statistics where User = 'root';
User	Total_connections
root	0
Total Connections for root should be 0
Confirm count is correct after flush
flush user_statistics;
select User, Concurrent_connections from information_schema.user_statistics where User = 'p';
User	Concurrent_connections
p	1
Connections for p should be 1
select User, Concurrent_connections from information_schema.user_statistics where User = 'mp';
User	Concurrent_connections
mp	1
Connections for mp should be 1
select Role, Sum(Concurrent_connections) from information_schema.user_statistics where Role = 'p';
Role	Sum(Concurrent_connections)
p	2
Connections for Role p should be 2
select User, Total_connections from information_schema.user_statistics where User = 'p';
User	Total_connections
p	0
Total Connections for p should be 0
select User, Total_connections from information_schema.user_statistics where User = 'mp';
User	Total_connections
mp	0
Total Connections for mp should be 0
select Role, Sum(Total_connections) from information_schema.user_statistics where Role = 'p';
Role	Sum(Total_connections)
p	0
Total Connections for Role p should be 0
select User, Total_connections from information_schema.user_statistics where User = 'root';
User	Total_connections
root	0
Total Connections for root should be 0
Confirm count is correct after disconnect
select User, Concurrent_connections from information_schema.user_statistics where User = 'p';
User	Concurrent_connections
p	0
Connections for p should be 0
select User, Concurrent_connections from information_schema.user_statistics where User = 'mp';
User	Concurrent_connections
mp	0
Connections for mp should be 0
select Role, Sum(Concurrent_connections) from information_schema.user_statistics where Role = 'p';
Role	Sum(Concurrent_connections)
p	0
Connections for Role p should be 0
select User, Total_connections from information_schema.user_statistics where User = 'p';
User	Total_connections
p	0
Total Connections for p should be 0
select User, Total_connections from information_schema.user_statistics where User = 'mp';
User	Total_connections
mp	0
Total Connections for mp should be 0
select Role, Sum(Total_connections) from information_schema.user_statistics where Role = 'p';
Role	Sum(Total_connections)
p	0
Total Connections for Role p should be 0
Confirm count is correct after reconnect
select User, Concurrent_connections from information_schema.user_statistics where User = 'p';
User	Concurrent_connections
p	1
Connections for p should be 1
select User, Concurrent_connections from information_schema.user_statistics where User = 'mp';
User	Concurrent_connections
mp	1
Connections for mp should be 1
select Role, Sum(Concurrent_connections) from information_schema.user_statistics where Role = 'p';
Role	Sum(Concurrent_connections)
p	2
Connections for Role p should be 2
select User, Total_connections from information_schema.user_statistics where User = 'p';
User	Total_connections
p	1
Total Connections for p should be 1
select User, Total_connections from information_schema.user_statistics where User = 'mp';
User	Total_connections
mp	1
Total Connections for mp should be 1
select Role, Sum(Total_connections) from information_schema.user_statistics where Role = 'p';
Role	Sum(Total_connections)
p	2
Total Connections for Role p should be 2
Confirm count is correct after change user
select User, Concurrent_connections from information_schema.user_statistics where User = 'root';
User	Concurrent_connections
root	2
Connections for root should be 2
select User, Concurrent_connections from information_schema.user_statistics where User = 'p';
User	Concurrent_connections
p	1
Connections for p should be 1
select User, Concurrent_connections from information_schema.user_statistics where User = 'mp';
User	Concurrent_connections
mp	1
Connections for mp should be 1
select Role, Sum(Concurrent_connections) from information_schema.user_statistics where Role = 'p';
Role	Sum(Concurrent_connections)
p	2
Connections for Role p should be 2
select User, Total_connections from information_schema.user_statistics where User = 'root';
User	Total_connections
root	1
Total Connections for root should be 1
select User, Concurrent_connections from information_schema.user_statistics where User = 'root';
User	Concurrent_connections
root	1
Connections for root should be 1
select User, Concurrent_connections from information_schema.user_statistics where User = 'p';
User	Concurrent_connections
p	2
Connections for p should be 2
select User, Concurrent_connections from information_schema.user_statistics where User = 'mp';
User	Concurrent_connections
mp	1
Connections for mp should be 1
select Role, Sum(Concurrent_connections) from information_schema.user_statistics where Role = 'p';
Role	Sum(Concurrent_connections)
p	3
Connections for Role p should be 3
select User, Total_connections from information_schema.user_statistics where User = 'p';
User	Total_connections
p	2
Total Connections for p should be 2
select User, Total_connections from information_schema.user_statistics where User = 'mp';
User	Total_connections
mp	1
Total Connections for mp should be 1
select Role, Sum(Total_connections) from information_schema.user_statistics where Role = 'p';
Role	Sum(Total_connections)
p	3
Total Connections for Role p should be 3
select User, Total_connections from information_schema.user_statistics where User = 'root';
User	Total_connections
root	1
Total Connections for root should be 1
Confirm count is correct after failed connection attempt
select User, Concurrent_connections from information_schema.user_statistics where User = 'p';
User	Concurrent_connections
p	1
Connections for p should be 1
select User, Concurrent_connections from information_schema.user_statistics where User = 'mp';
User	Concurrent_connections
mp	1
Connections for mp should be 1
select Role, Sum(Concurrent_connections) from information_schema.user_statistics where Role = 'p';
Role	Sum(Concurrent_connections)
p	2
Connections for Role p should be 2
connect(localhost,p,bad_pw,test,MASTER_PORT,MASTER_SOCKET);
ERROR 28000: Access denied for user 'p'@'localhost' (using password: YES)
connect(localhost,mp,bad_pw,test,MASTER_PORT,MASTER_SOCKET);
ERROR 28000: Access denied for user 'mp'@'localhost' (using password: YES)
select User, Concurrent_connections from information_schema.user_statistics where User = 'p';
User	Concurrent_connections
p	1
Connections for p should be 1
select User, Concurrent_connections from information_schema.user_statistics where User = 'mp';
User	Concurrent_connections
mp	1
Connections for mp should be 1
select Role, Sum(Concurrent_connections) from information_schema.user_statistics where Role = 'p';
Role	Sum(Concurrent_connections)
p	2
Connections for Role p should be 2
select User, Total_connections from information_schema.user_statistics where User = 'p';
User	Total_connections
p	2
Total Connections for p should be 2
select User, Total_connections from information_schema.user_statistics where User = 'mp';
User	Total_connections
mp	1
Total Connections for mp should be 1
select Role, Sum(Total_connections) from information_schema.user_statistics where Role = 'p';
Role	Sum(Total_connections)
p	3
Total Connections for Role p should be 3
select User, Denied_connections from information_schema.user_statistics where User = 'p';
User	Denied_connections
p	1
Denied Connections for p should be 1
select User, Denied_connections from information_schema.user_statistics where User = 'mp';
User	Denied_connections
mp	1
Denied Connections for mp should be 1
select Role, Sum(Denied_connections) from information_schema.user_statistics where Role = 'p';
Role	Sum(Denied_connections)
p	2
Denied Connections for Role p should be 2
Confirm correct count after per account max connection limits reached
update mysql.user set max_connections=2,max_user_connections=1 where User='p';
flush privileges;
select User, Concurrent_connections from information_schema.user_statistics where User = 'p';
User	Concurrent_connections
p	1
Connections for p should be 1
select User, Concurrent_connections from information_schema.user_statistics where User = 'mp';
User	Concurrent_connections
mp	1
Connections for mp should be 1
select Role, Sum(Concurrent_connections) from information_schema.user_statistics where Role = 'p';
Role	Sum(Concurrent_connections)
p	2
Connections for Role p should be 2
select Role, Sum(Total_connections) from information_schema.user_statistics where Role = 'p';
Role	Sum(Total_connections)
p	5
Total Connections for Role p should be 5
connect(localhost,p,pw,test,MASTER_PORT,MASTER_SOCKET);
ERROR 42000: User 'p' has exceeded the 'max_user_connections' resource (current value: 1)
connect(localhost,mp,pw,test,MASTER_PORT,MASTER_SOCKET);
ERROR 42000: User 'mp' has exceeded the 'max_user_connections' resource (current value: 1)
select User, Concurrent_connections from information_schema.user_statistics where User = 'p';
User	Concurrent_connections
p	1
Connections for p should be 1
select User, Concurrent_connections from information_schema.user_statistics where User = 'mp';
User	Concurrent_connections
mp	1
Connections for mp should be 1
select Role, Sum(Concurrent_connections) from information_schema.user_statistics where Role = 'p';
Role	Sum(Concurrent_connections)
p	2
Connections for Role p should be 2
select User, Denied_connections from information_schema.user_statistics where User = 'p';
User	Denied_connections
p	2
Denied Connections for p should be 2
select User, Denied_connections from information_schema.user_statistics where User = 'mp';
User	Denied_connections
mp	2
Denied Connections for mp should be 2
select Role, Sum(Denied_connections) from information_schema.user_statistics where Role = 'p';
Role	Sum(Denied_connections)
p	4
Denied Connections for Role p should be 4
select Role, Sum(Total_connections) from information_schema.user_statistics where Role = 'p';
Role	Sum(Total_connections)
p	5
Total Connections for Role p should be 5
update mysql.user set max_connections=100,max_user_connections=100 where User='p';
flush privileges;
Confirm correct count after global max connection limits reached
set global max_connections=3;
connect(localhost,p,pw,test,MASTER_PORT,MASTER_SOCKET);
ERROR 08004: Too many connections
connect(localhost,mp,pw,test,MASTER_PORT,MASTER_SOCKET);
ERROR 08004: Too many connections
select User, Concurrent_connections from information_schema.user_statistics where User = 'p';
User	Concurrent_connections
p	1
Connections for p should be 1
select User, Concurrent_connections from information_schema.user_statistics where User = 'mp';
User	Concurrent_connections
mp	1
Connections for mp should be 1
select Role, Sum(Concurrent_connections) from information_schema.user_statistics where Role = 'p';
Role	Sum(Concurrent_connections)
p	2
Connections for Role p should be 2
select User, Denied_connections from information_schema.user_statistics where User = 'p';
User	Denied_connections
p	3
Denied Connections for p should be 3
select User, Denied_connections from information_schema.user_statistics where User = 'mp';
User	Denied_connections
mp	3
Denied Connections for mp should be 3
select Role, Sum(Denied_connections) from information_schema.user_statistics where Role = 'p';
Role	Sum(Denied_connections)
p	6
Denied Connections for Role p should be 6
select Role, Sum(Total_connections) from information_schema.user_statistics where Role = 'p';
Role	Sum(Total_connections)
p	5
Total Connections for Role p should be 5
set global max_connections = 151;
Confirm correct count after connections closed for the idle timeout
select User, Concurrent_connections from information_schema.user_statistics where User = 'p';
User	Concurrent_connections
p	2
Connections for p should be 2
select User, Concurrent_connections from information_schema.user_statistics where User = 'mp';
User	Concurrent_connections
mp	2
Connections for mp should be 2
select Role, Sum(Concurrent_connections) from information_schema.user_statistics where Role = 'p';
Role	Sum(Concurrent_connections)
p	4
Connections for Role p should be 4
select User, Concurrent_connections from information_schema.user_statistics where User = 'p';
User	Concurrent_connections
p	1
Connections for p should be 1
select User, Concurrent_connections from information_schema.user_statistics where User = 'mp';
User	Concurrent_connections
mp	1
Connections for mp should be 1
select Role, Sum(Concurrent_connections) from information_schema.user_statistics where Role = 'p';
Role	Sum(Concurrent_connections)
p	2
Connections for Role p should be 2
select User, Lost_connections from information_schema.user_statistics where User = 'p';
User	Lost_connections
p	1
Lost Connections for p should be 1
select User, Lost_connections from information_schema.user_statistics where User = 'mp';
User	Lost_connections
mp	1
Lost Connections for mp should be 1
select Role, Sum(Lost_connections) from information_schema.user_statistics where Role = 'p';
Role	Sum(Lost_connections)
p	2
Lost Connections for Role p should be 2
drop user p@localhost;
drop mapped user mp;
update mysql.db set User='' where User='root';
insert into mysql.user select * from mysql.user_bak;
drop table mysql.user_bak;
